{
  "$schema": "https://json-schema.org/draft/2020-12/schema",
  "title": "Agentic Automerge Policy",
  "type": "object",
  "required": ["schemaVersion", "enabled", "mergeMethod", "requiredLocalCommands", "blockMergeWhen", "gapPolicy"],
  "properties": {
    "schemaVersion": { "const": 1 },
    "enabled": { "type": "boolean" },
    "mergeMethod": { "enum": ["merge", "squash", "rebase"] },
    "deleteBranchAfterMerge": { "type": "boolean" },
    "removeCleanWorktreeAfterMerge": { "type": "boolean" },
    "allowNoRemoteChecksWhenLocalGatePasses": { "type": "boolean" },
    "requiredLocalCommands": { "type": "array", "items": { "type": "string" } },
    "requiredPreflight": { "type": "array", "items": { "type": "string" } },
    "requiredArtifacts": { "type": "array", "items": { "type": "string" } },
    "blockMergeWhen": { "type": "array", "items": { "type": "string" } },
    "gapPolicy": { "type": "object" }
  }
}
